<?xml version="1.0" encoding="UTF-8"?>
<!DOCTYPE catalog SYSTEM "catalog.dtd">
<catalog type="opds">
	<site>smashwords.com</site>
	<title>Smashwords</title>
	<summary>Ebooks from independent authors and publishers</summary>
	<link rel="main" type="application/atom+xml">http://smashwords.com/atom</link>
	<link rel="search" type="application/atom+xml">http://smashwords.com/atom/search/books?query=%s</link>
	<advancedSearch style="quoted">
		<field name="author">authorFullName</field>
		<field name="titleOrSeries">title</field>
		<field name="tag">categories</field>
		<field name="annotation">description</field>
	</advancedSearch>
	<relationAliases>
		<alias alias="x-stanza-cover-image-thumbnail" name="http://opds-spec.org/thumbnail" />
		<alias alias="x-stanza-cover-image" name="http://opds-spec.org/cover" />
		<alias alias="bookinfo" name="http://opds-spec.org/acquisition/buy" type="text/html" />
		<alias alias="" name="http://data.fbreader.org/acquisition/sampleOrFull" type="application/epub+zip" />
	</relationAliases>
	<urlRewritingRules>
		<rule type="addUrlParameter" apply="external" name="ref" value="geometer"/>
	</urlRewritingRules>
	<icon>data:image/png;base64,
iVBORw0KGgoAAAANSUhEUgAAADAAAAAwCAIAAADYYG7QAAAAAXNSR0IArs4c6QAAAAlwSFlzAAAL
EwAACxMBAJqcGAAAAAd0SU1FB9gLFAUcBH3DnpQAAAizSURBVFjDzVldbBPZFT73zp3x+Dcex3+Q
xCyQApuyDeW/P1poVRVoQAmiu32oEFKFqqq0TSAPFKlVxUN2KRJqeaOr7q60oKK8tGSbVKVC4oFF
2y40S7qgANU2hIQswY7tzIxnxvNzbx8GjJM4wQ5L1aMr+Xrm+Nzvnr977jFijMH/E+Eq+cpxV78H
RVEopS8EEEIIAO7du+fOn4mJUjowMLBjx45bt27VpiJWNQ0ODvr9/s7OzmqYDcNob28HgNHRUVYL
1QBIVdVIJLJ69erx8fFnMmuatn79+o6ODsdxKKXVr1KDD/n9/hMnTty5c+f8+fOO4yxgNVf0xMTE
1q1bS+b+/E3m7ru1tVWSJFmWF+bM5/OhUGhgYIDVSHgWsoXjSBTFnp6eVatWEUKe6ddtbW0tLS21
Ri4qB4EQ0jTN5/M9Zy5xRc2dz+VhjKXT6VgsVuLB5YF9+fLlnTt3njlzZj4lVZmByhHM50AIoWw2
e+jQoT179kxMTFT2oV27dgEAz/Pnzp1jjNUUHdWTKzaTybgu39XVNW/YDwwMxONxURQB4OzZs6Zp
shdDd+/ebWlpaWxs7O/vdyGWNg+zgD948KC3t3fv3r2EkJMnT74INLIsHzx48MiRI24+m2UHNMvV
XZMXCoXR0VFBEJqbmz/349OyLEVRJEmq6F5oPud1ud23bjiUP1nYkRcXjwsBqshq2/bFixez6UmE
y/M7A0AIIZ4QhBEAMECEEMJx7mue5zHHMcYwwoQQBoAQEI54/YG1a9d6vd5Z65L5YhshJMvK6dO/
tW2b47hwODw0dOO9s38Q482AEEBpG4g6FlCKn6CkjoWAIYQBgDomAoQQMMaYY7s81LE4jvNh++13
321ra3s2IFcxb7zxZv+f379+/bpl28lkMpvNih4+sHTN5p+cc4qFGZUGsBn6YqwMLit9Mva4MGLU
QQj//fT3NFWpoR46+es3P/z47vLVawkhfX19HR17+/70R1847tiWY5vlg9nW0+FYjNqMOk8GfTzY
0zINczxCCBzTW+lImBfQiuUvBVZs/HbH99esWZPNZiUpXDR0m/NiDrtaXBwBACBwLANTq1pArg8t
Wdqg5dNKQVuyJKGqajweV1UFPCH03GGPEHIsQ0COr0pA7j4am5qoJhf0YmNjk23bsVhsOp/n/ZGF
jrPHrxAAKj+U5izAOUWd5zlfTSZramoCS5NVrWFpg67ryWQyl8sLgXpWoWgvZVkAzGn5R4YyBQhj
ImDMoUobtg2V5wWvtwIgMh+gxsYmoLasFJYsaXYcJ5lI3PjnR57gMsacuXrBmHCinyPCnb+c1u9e
0gqFL3y3h/jrBG+IeLyM0hkpDWHLUHmBr6iheQE1NDSAY8tqIRqLFotmLBbL5qfFYIRRZ07+xIY8
+e++s0ZmJGg/+uTGxz8/evTtd34aDXl0ym/48TluJiaEsaVN87zgnuLVmiwej4NjqQU9GAhijOPx
2LSqC74QMDozTQMg9mlfzw+/2fSdTS8JhESjsZdbvphKhMfHx1uaU9S2MMcjhJ/WhAhb+jTP8+Kc
NL0QoPr6esQjTdc5wkmRSKQ+quqWRwwwyma6BaKmKXnZkaO/+NGhnymqqqpqS0tLLJH0iF5C+Nt/
e2v4r79ziupTqyFkFfKiIIgeTw2AJEkK+ERdL1KHSuEwUEcxKCd4ABiU1YMADBHeAj6TTq9bt44Q
ks/nk8lkLpcDANMsbllqvtqgj/3rMiDsahQBMgu5YChACKkBkCiK4VDQtMyCVli+YoWqyIaDuMe1
/QwdYUwsEGQ5Hw6HI5GIoih+v980Tdu2TdN87bXXX/nSK2bRerIBAISK6nQoVFfDVdo96iUpbJtW
NptLJhKyPG2CgDBXSQaiJKDIimvobDZbSmaO46RSqVw2xxG+TDo1tXyoLlwDIFdcIhphjpXJZAFA
UWSHE2G+pEhE3dDdUEin0+6W3DbDsmXLcvkcJ3hKZwBjrKhOh8NSzc2GRDwGzElnpgBAkWVGAgwq
tjIQAOUwdgHJslwsFt0yWRCEeDyezmR5bx1HBI4IHO9BGJuGUheurCGyAKB4Ig7sk6n8NAComg68
15QzdlED5p7h7nluA0J2IesRvQAQCoVUVTVNEyFkGIYoij6f79Hkw4x8sTgx5FgGtU3m2KBmpPpY
bYAQQtFoDKj92cNJABj5z6c2EC37gFoGAsSYwxgghCi1MccjS/eIIgBs2bJFkqRoNHr48GFCSHd3
N8Z4Kq9EX/5WKJYChBDCgPBng/11dXU1aygiSV6feP3WyPJUowKBVa+f8EdTT8Ielcda/h/vhYJB
AGhvb3fLjK6uLozxvn37KKUF3VzWvNVfnwRKMcfLD4YBIJVqqhnQqtVrID8a+HK7RVl9tDF9+4OH
psEYBcdGGGxTZ5Qxx2aOmQpyDY0pAOCelNKliSzL6Yl7uXcOYUKYYwIgM/9w06ZNO3bsrNlkX/nq
135zsmeg//30o4wnfadOCnuCHo7jxsfHP/jwo2+8+vVYMnZj6IauG7986/dhSaqYO65duwaM/urw
D8JSmOMIx3Giz7drV1v5Taaqdkzp/qaq6tTUVD6XKxRUTdMMw8hkMsFgsLu7mzE2MjIyNjY26yfl
8+3bt2/cuHEB+YvvoJULOnXqVDAYHB4erijd/Wqa5oEDBwghg4OD1XcKYNE34m3btm3YsOHmzZuz
LufuhFLa1dVVX19/9erVmvoWsOj2xcTExO7duxOJxIULF+Yuefz48Wg0eunSpVq7KPA8LRXbtjs7
OwkhbuuutPCVK1cA4NixY4uQDM/Z5mGMbd68ef/+/bN6woSQ3t7eRTSZ8PPcZkrdDM/MUmtsbMy2
bUmSFtGEWDwglzRNGxoaSiaT5Q9lWQYAVVVf4H8d89Ht27dFUQwGg+UPVVX1+XzFYnExin/Of4Ns
2x4eHvb5fCtXriw9nJycvH//fmtrqyAI/1NAFdu/1fSEF6D/AmCU/2ALMCZ7AAAAAElFTkSuQmCC
	</icon>
</catalog>
