<?xml version="1.0" encoding="UTF-8"?>
<!DOCTYPE catalog SYSTEM "catalog.dtd">
<catalog type="opds">
	<site>feedbooks.com</site>
	<title>Feedbooks OPDS Catalog</title>
	<summary>Feedbooks: Food for the mind. A place to discover and publish e-books.</summary>
	<link rel="main" type="application/atom+xml">http://www.feedbooks.com/catalog.atom</link>
	<link rel="search" type="application/atom+xml">http://www.feedbooks.com/books/search.atom?query=%s</link>
	<link rel="signIn" type="application/atom+xml">https://www.feedbooks.com/user/profile.atom</link>
	<link rel="signOut" type="application/atom+xml">https://www.feedbooks.com/user/signout</link>
	<advancedSearch style="separateWords">
		<field name="author">author</field>
		<field name="titleOrSeries">title</field>
		<field name="tag">type</field>
		<field name="annotation">description</field>
	</advancedSearch>
	<feeds>
		<condition show="never">http://www.feedbooks.com/news/catalog.atom</condition>
		<condition show="signedIn">https://www.feedbooks.com/user/profile.atom</condition>
	</feeds>
	<authentication type="basic"/>
	<icon>data:image/png;base64,
iVBORw0KGgoAAAANSUhEUgAAADwAAABQCAIAAADKqIEEAAAAAXNSR0IArs4c6QAAAAZiS0dEAP8A
/wD/oL2nkwAAAAlwSFlzAAALEwAACxMBAJqcGAAAAAd0SU1FB9kLCwoVC/TE6x0AAA1oSURBVGje
7Vtbc1vXdV5r730uOAc3AgTAm0TaoiXarpXUrqIknqZpx26mjd2ZvrYz/QH9MXlvX/ruybQPnUzb
cR+ajmQlauTEkUTJlmTxIoEgQeJ+gHPZe68+HACCKBIUb6I9kz14IsCDb3/722vt9a0NJCL4tg0G
38LxrQQtTvXpBKA0+VITkS0YZ8gQv9GgI6U7oay0w9V6lwhyjjGdtouuaRv8GwdaEyFAN1Lrzd7d
SvtWuXmv6hFRwmBvl1IfXSq9VUyZgn2zQNe70b2tzq1y47cbzc1OAICR0gDQCqAbNiKlisnXZtL2
NwX07zeaD7a95WrnSdPf6YYNPwqV5gwREQEIoO5Hy1udRzvdgmsZHM8SdNOPVhvdx7Xe7zaaq/Xu
RifsRQoQGKDBn8mAIYQE7VC1AhkpbXB+BqCVJi9Um56/vNn+vNx8sO3t9KJIkSJCAASQWmsChjgk
FQEQEJEAX/lG1ARK01qj+/lG8/eV1kq9W+2EXqgIQSCyASCDMwQEGEm5CAyBIeArBt0J1b1q+6uq
97ju3d/urDX8UGqDoykYAgCCVNSNVNo23imlFvNu1QuurdQkEY+REhAAvbKQt9HyW4G8X+38z+Od
m+t1X2nXFIKhaXIC0ERKk9Q0nbIXLHEh53xwofDubPrW0+b11ZpSxDkiAOEg65wqaKnJl6raCf/1
bvnGWn2nFyGiZbDh/tcACGBw5hpMEX24OPnhYuG1nBMnP0WkNBCRJlJEmgDhmYROGHSsRKn1g23v
04fVLyqtbS9sBVIRcQZ8oEoiICLb5Is5989fn1wqJmfTtmvyfpZBZIiAoGNyCRGBs77S9QsHTNaX
2FFBI8JmJ7i2snNjrf5wxyu3A1swwRkfeaYmMBjmEuZUynot57gmV4pW691IaUUQx+YtL7gym1Ga
GKIiMjlr9qLPy614CxD1tUIAALQ0mUrbBiDQWOg45jz9nw+2/uXW+lfbXsYWDPfY8ZrI4qyUtKaS
tmNxpbQiGH0gAQiGjsH7+BCIKFA6UkSDWRE8A/5HU6kfnM8tZJ3xqWdfpm9XWr950mz50haM7xOi
GGKkqdwOKp0AADXswQACCMQ+QOyrQu/zpb9c2bmz2f7HqwsLE86RNA0AABxRsH4SHpNlopgv3PtB
0R4LDHv+TWp6tNP935Udx+DFpHXoIuB8JjGbtiKt670oUFoRyX1eKp7RfuuJe72Ge536S8ERGWLa
EvVeeG2l9qjWPQrT2YRxeSq92ujdr3ZCqduhhNFEdgJH+fgZFGnypbYEAwDOsB2octtv+tER4/Sb
xZRrikc73te17pOWHyflYWw5gVIPgQBqPbla7/pSD0V5YKk9DrRj8KVCci5tv1lMNYMIn+f3AKW/
RCUWZ5/NTnBttXZ9taY0AAICcMTxpBycEZOWSFqnWJUtBLLqBZ+t1gk0vpzszrga10T1Xtjw5aHW
7OwthCMcVMX4cnq7G9Z7ESBMOlbRNU8N9wmBllrf3mxdW6k9bfkGZ1Mp+6eXSucylmDsjCGPAb3j
RV+UW798XCu3fYuzgmtezLuTjpG0GJ411fuCrvvRlhd2QhVpAtC9SDV6UaT16fhQJwQ60loSGRwt
zgyGJmcvE/aPyvPhqGbjnoT940Fc1bET8eFOInqw01zGP1i9R6jGx+tOExHtXolYYKOaIgCt4wpm
91uv2hYLlX7a8sst35d6GA6VBluw6bQ1nbKdgbfbDqLblXY3UrbgBdecSyfiEvjEQOOL7O6zZdab
/s/vbHy2ulP1QjGozAJJuYTx/vzER0ul70xnAKAbqt8+bf7s+uNy2887xtW57MdLU5en0oiAp8g0
9kv80fHr9fo//99KuRX4EYnB2whgCWwF8sZaXREhwuWpzHqz918Pq16kbMGavlze6pzPNgtJ0+Sc
8JnZ9zIBUBwqcvDnD7q9SD2seQ+2uwRgcsYBNUFPKqWJMQykirTuhCrO/JGmXqQYgslZqGTDjzY7
QTuQBVcAUDuQkdYcsR1Ii7NQ0clsxBc339Omv97waWCyKCKL8zcm3YwtpKJOKFOWuDqXncskiIAh
GIzFlQMDRACliYiytninlP6LC/lIESAoRcWkOZ9NnNhGJHhWdEtFa43eWr3HEBlgbKDlEvynS8XX
JhwvVF4gXZPPZ520JeKeRvyv8SQNzjhjCGgJdnkqPekYsb3GEBMGzyeMEwOtRxZNEW16wZYXsIHR
H0eMd2cyc+lEpHSoNEe0nmuv0LBUY3FNhQAArsnfmEwOfR4CIAJFxPYpu8RL67lvR/WXFaAZRLEQ
AWmwhSg+n0SaENE1xRiNEVBcDgJAw49avtzyAi+URICIaUvkHTNti6QpxAu7/9BxWhM92vGetPyd
Xlhu+UMyEIBz7Ebq2krNNXneMV/PuQXXFHueZClmGiOlq15wY71eaQWPal6tF2oNjGHBNRdz7lIp
+U4pnXph8ofUNEGlFXxye+O/H20HSiUER4RhnDUYawbyn26uhopKrvmTi4WPl0qzmcTu4D/YFr1Q
fVnt3nzS+LflSii1gr7BhwAPqt7tSvsHnWzeNt+YdHflzkMyjXB9tf51rUtAguGL9masElPgWqt3
e7P9/nzuGeiRJGJy1o3UzaeNLyptAupJDQQw6IIRAGPQjdT11frTpv+3b01/8EbhGKAJlgruZ+ui
VZFSUcYWo21MBFBEnUCFWpsMM5awBd/b8QDQBF6oOiQJIFA6kFpr4gxtwW2DCUQN0Arkl1Xv2mpt
fsJZzLtDug/N9FIh+cHi5KRrtgNZafvllj/MA1KTa/Ifnp8QnLkG/5PZzFRqnIlICJLAFvzyVDpl
CwNRamr0ooc1rxvphGCCYUR0Z6v9H19t/cMfz2UHcfDQTBuC/Wghf2UuG0j9i/ub/35vUyoV6yLU
esa2/+47c8WkRQCuwR2DjQ/5pmCLeefvvzs7n3UYAkP8cqvzyZ3y3a32wIKizU5wc71+9Vz23ZlM
3Jg8NNMEkLJEyhIxr6OyJgLOcDpl5ZyDzQapiTNYzLl/dal4ZTY7bJNmbCEY/vzuxm+eNjkDBCSg
ZiDvVFpvF1Pxx45eBPiRCqQe3YgIoIkiTQeeCAiAiFxDLBWSV+cmRhu7tuDfP5+7kHN7UikNiGAw
pjQtb3UCpY9UudDxiruRYC8YK7jmwoRTdHfrnjGYTltTSYsz1AQIEGm95cUUnV25pTWYHEtJayZl
7znz1yfcy6W0wVFpetFcZofV9InU3xpIcMxYIrlP5WIKljA4AtJe33wMeRzDnCECBORs3y5oqLSv
9H4snQXTAIigibqR6jcAXhidUNZ7oSbaUzziDJgG4IihpG0vavT27q2s1LvLW20iEAw1PX8GOCum
BUNfqccN7+5Wu+XLXe/2IlnrhiMVFxmcTbn28MB4XE3jUSQNAMAQvVDdKjd/8eVmfYTvStv/5Hb5
1+sNgyFjSASh0ibHH87nhlaEOA7Tut+UxyP8P2dIRE+b/qcPq1LTpUnHEtwL1b1q59OH1fWmbwsG
ABqIMyy65ntzGfuIoGmP88NzBhKNry9pCBwBNEBPqsf1bnO5Mp+1LMFbgay0g+1uFLfGpSZNNJOy
vzeXLboWHt9hQsCEYLZggZTxxaQD1EJx+T2cOyEAZyg1rbd6tW7AOQuklposzgzONFF8YeC705kP
FgvGSAdCvNyaDu7DjIAyGJ7LJObSiW2vxRghoMVZ3jH26/5zRFvw+LaKVOSafCZlJwTb9IKqF0oC
pTRHNAQDhFBphlh0rbdLyQ8XJ3f198Whs8JI0npnKr3W6K3Ue4HSBDCftd+fzyX2upWJgJmEcamQ
fLDj1f2IpDqfSfz1xdJ0yrqxVvvVer0ntdQ0LMgdwyi45vfmsh+/WZpLJ44Tp3GXYvOO+eMLkwZn
96ptX6qrcxN/8+b0nlc1EGEqaX20VEKgO5tt1xTvzWavnsvmHfOtUvInF4vXVmrrzV6oSBNpoPdm
Mn+2kM+55p4UHNc1nUnaHy4WrpzLKkX5/WrvwZhIGH95sXjl3ITJWM4xUpYAgIxtJE1jImF4YV/z
BDDpmIX9O4DHBS045h0z5xgwKEzHj4JjTTrmrg9zBqO3Tw+MoifgT4+6CAcG7dEPD0cgdaUTEBER
GIIlTb6nR3NE0AdayUdIkFLTg2rnZ599HSodKppOWX+6kPvRQn7MzZoDrgONokAA5zh3cfcZgVLL
1c5X216odKh0y4/mMva7M5kiWEdhmgbyYoiB0r/baPWL2ZMbRFDrRZ+XG7bBLcEipRnDli+7kTqK
poeIEYAj+FL/aq1+80njxJmOb0b2EwBifJ1sfJdVjI/KNIhBAOArLSM68d/FMETBMN52kdJ2wphK
WWlbHAW0Y3DX4AioNMW+rMHQYKfRsx1sIQKpyBZ8OmWnrSOZ6kXXuJBz7mfsQCkAUOp0+7UEYAuW
d4zz2cSBrbp9Qacs4+q5CU1084mxUu/udCXD0yplYj7OZ+zFSff757Jvl1ImZ2OPE/trVBGFSvuR
rnrh41p32CPcfWds3DTwIEUMD+J0cTKZtQ1TMOOg3/Dgy2wsqakbKnw5SwkPSfAw9iVN8ZKWFf7h
V3KvaPw/AMARafW5GgkAAAAASUVORK5CYII=
	</icon>
</catalog>
