<?xml version="1.0" encoding="UTF-8"?>
<!DOCTYPE catalog SYSTEM "catalog.dtd">
<catalog type="opds">
	<site>litres.ru</site>
	<title>Каталог LitRes</title>
	<summary>Продажа электронных книг.</summary>
	<link rel="main" type="application/atom+xml">http://data.fbreader.org/catalogs/litres/index.php</link>
	<link rel="search" type="application/atom+xml">http://data.fbreader.org/catalogs/litres/search.php?query=%s</link>
	<link rel="signIn" type="text/html">https://robot.litres.ru/pages/catalit_authorise/?skip_ip=1&amp;lfrom=51</link>
	<link rel="signUp" type="text/html">https://robot.litres.ru/pages/catalit_register_user/?lfrom=51</link>
	<link rel="refillAccount" type="text/html">https://www.litres.ru/pages/put_money_on_account/?lfrom=51</link>
	<link rel="recoverPassword" type="text/html">http://robot.litres.ru/pages/catalit_recover_pass/?lfrom=51</link>
	<advancedSearch style="separateWords">
		<field name="author">author</field>
		<field name="titleOrSeries">titleOrSeries</field>
		<field name="tag">tag</field>
		<field name="annotation">annotation</field>
	</advancedSearch>
	<feeds>
		<condition show="signedIn">http://data.fbreader.org/catalogs/litres/my.php</condition>
	</feeds>
	<authentication type="litres"/>
	<urlRewritingRules>
		<rule type="addUrlParameter" apply="external" name="lfrom" value="51"/>
	</urlRewritingRules>
	<icon>data:image/png;base64,
iVBORw0KGgoAAAANSUhEUgAAAIAAAACACAIAAABMXPacAAAABGdBTUEAAK/I
NwWK6QAAABl0RVh0U29mdHdhcmUAQWRvYmUgSW1hZ2VSZWFkeXHJZTwAAAyk
SURBVHja7F1NbBvHFZ5ZyZJQ2CTTwHGi0BaL/NimFFEtksZObEvKIQVyKGQ0
B6MJENuHnorCTgr0FKXurahR+FD0UKC120MRoEYjtMih6cGSHbeMi8KSnNCS
fwLaImw1kmuKYozUkrh9O8Md7pJLcmd3Z//IZ2W5XJER+b5573vvzcxbLMsy
EiZyfhat3kTrRd3VjS+Vi1WvLH5eftnmp6QXfo1aRjrF/u8XPpCX/8H3luJN
gA3HBlsEAEns/377QSvvuvv31rEAsQAoA7lnG7fjWvyo2mu1AbCOwTfetEIe
Cx+0CADYMgnn8/kjR47AcWhoKBqNxmIxOIHrCSLaV5YufI97RPdsk/b+oQ1A
XZmcnDx48CBov8FrAI8YkbeGO76bWuX+ZLvfwY+/2gbAQI4fP37q1Cnzr49t
7rz3l1cs8Af+5i/aAOgkm83CwJ+enqZPR0ZH33jjzWKxeG1+HmM8Nz+3urqK
Ebp06VLVG3/3k4G3vtPL++He/mP3zI1V6uKUPzcyYujiWgWAiYkJ6vThfMuW
LePv/XR09BUswT8QSSIPmhMMwMzNzWGMrl69urWn8MO9V3k/3O//dufozz9t
7OLgZHh4WAsMux4qALRuZ/+BA++++14kElF0TfQtGQBQQYI8wY8v/rLnq2t8
PF9cf+r75+Fo7bsxi+nr69MCQ68HCYAzZ87A2KfnTz/zzP79B3p7e5/o7QUN
P7tzp4IElvSmIOEyNJVL3Wu5R+//SUm+1+/Bj8nP96/73/r34o6FhdtwfuXK
lZWVwspKHk7sf3OtxXjo4kwBADHP6OhoE3pAaO3554EA5C2R0q5dCFzPk0/K
8TioXn7xRa0pUHhAwCDgVQoea/cQRl0P5uDzdKwtdawtV0LYrq2ryV/Bb5U3
IMxO4L/bROD0yuzsCpHZ2Vl4yy0i9lXjjotzEoAmEonIu3crSVYyiSNRRZV7
9yqqjEbxQH/FW6Hyo4IHRgDG+uak3P1YBQIVAMROKk91x/PnL8BDPg/AzGiB
mZqackR3jrg4xwD4GKG4zbHQ348iUUWpL72k6DMakwYGQJMdzz2ngISrAGD2
UAcJHSDqA3tEGFzZzIwCDBzBeujXhCOcszDPjgAYp0+fHhsbcwmA9xHaI9hd
drz8MihQikYBEuXp4CCcw5VN+/fXAED/Vam/GgWGhu5UfQIwaIGBEJwaEFxv
nIEyOXfuXFNr6ETBkY2LF5UjkM2HHxoMpWi0c1ApYsNRIq6g68ABpdoVi21K
pWRFq8pgU5SrfSxrW71EK1HkOq2sMA6oxakeMPS6w2Go7i97ZAE2BWDAJNrp
Jgq925dYTPRFEEqlhjoeiTUwBfOqWF9fv3Hz8927dobTAmzKGvH4IA/Pn1fi
K4R+hFBG/W0Soa3Dw4DHYCLR0Zfox+jRVAr8OFzv0StRYzc6WV6+N3/t+pcP
HnB9qhYCoDooQ+gkQocQKpCnGRIeweGvRjESwPD1RAJ+ksSSBmIxePtjIyMU
Hhj489dvLC0tbWyUvvjiP0Iy4RC4IEMBvb9m4+3wlf98d/H27YWHa2ul0gb8
u3z58jtvH9PYShNxbEKmEEw7SBI7sCOg/VKpRLNMmmdyvd0sAE2z80xgfdHr
CB2zk76Uda9JJT0BINByjMBgJTLu7WW6l8owICEAhF7GiTvildITvbjGBLwE
ILiOKELiCN5qSoRWRaQKBqyMwfI4VwEoBJaNKQa/IUfz0q9ygMYOKrUgb1xQ
cI3AUlCEqwQhMS5IUw9pMoiCLq9yYiDhahbwhgPS6ggKgbxuPigiHCBpZ5s4
/5bzLigdCgxOElNoHoa+8G2EdMO/WCx6zAGhkZMmDBpXk4B07Xp54UEqlWoD
IDwoSmJcy8IeZ8K5EGEQJ8lBAwyiNWGQqCioNQGgYcV4MxLWAdAuRYgIisYb
6R/Z8EBOh6HI9toIf8rReoFpNFJlAXfv3KG/Mbk4xXkLyIXUDgyDInl3EuuX
NN1RAWi7IOfl/RoMbAdBpgHw1YJWDwPTk/qgaK9BFOQDEs6EF4MksYMqE9Ca
gi8AKITaDrQVU4zrWoA38wGtE5geNUoD5ufn2GtM1oKcXBeUUTkq1wIYjFND
7+/XLgxeXeXei8hhAU2TYep59rQGADQwJWsddTTgJQAtKGo1FFnl4DYH2EUA
qyviMaUE3sEqZG1oupX0rztifwCAWgsAmR0vffJJ2wW5mRlHKuyLrNSi+QBo
ujAiV3MS7twYDwxgFvtYmw1w1gVRvceNAEibXjDBdkM8nJ4umduK5WEIpG5w
Kj9YsADnOSBeJ303KdvOnau9CEg81OxchHOZbJ8z/JWbsFHSlRkMKgIml1EJ
JOGC1UVaoD6pJomHK9p9Qj3mSrNabO4fP/7Qic2nNUaAyzDIMui/UCh4bwHM
6e+pcVBmJstATT0Olb61sEmC2neUw3+ZGkHmKjfZuZcJh7E+UaZdG4kwjwW4
U4oQ5MFF+B9px3ZQvUz3gCOLnd+czAMKTsSdbDOp/3HF23eoKUB5Xz77lcnJ
AIcByNQBI6ypAF2FpepftyrLfDsV50k4acI+XJaveHoHcEdBxPtQF5TLLXhf
iojYo1xxyhJDwhoTQHhhgRsADgvgWhiRM5GdBd8HEROwx8IuVUPjntao/+dQ
hyZD/VO3LyMZW4oYfVeOFhEvCpLOfftY4IN1+vcIAC3NWh7vPi/A1cRBDAHF
CDx2QRm/ZsKiiJ0wL9P6Z59+JjwRM5lfROwBsJ7NBoWD1XlI5aewUhAOgMn8
Imkv83IcAFFuDWOWjqHKfLDXeYD5zMu11EwQsbNEuDwfqfIBV7zu6pxwxhxn
BIWHpb4+tTdjJR71tQWYHPLO1uPEwdmxo09Nga0jIIQDDAd4bUMzd1IzcYkF
rhQhlONF0lVTbBiaSqUmJiYavCDtROe44pkzNHDsGhpiM1k4Gu3SxGCdiUSn
90slaRGC1OIszci7nQmbhAeiIBoImY/ftbOYgFmX6XK83TyAVCHKESlnsC4Q
gLi9MNR+qvWgoZk6qH9V+bocmDbD9x6AggmDCLYwD4QQsuaAXHZBYapRdw4O
lvWvNpxecSET5vJuuVADgCE6UGtxNAezdl8PPgvgCkPDvU9GMwevTsmoz7mW
j3jZNTEdAhRqF0R4C0ChITNnQmcFquqtluJE14LSegAKYdM/QsjyxgCRpYg9
KPyCqSo0NEzv4eSjKCjcNLBpcJDdmoZ6oBV1xTxXqCLWBWVCSLwVG6hoX5+I
cQ1TsQCEuWkEm5BEusl5j0k4xH1SjPRfMQWXSJh3yDedk0kHHQPNPclcAoDL
wWUaXglBo2l2X74L5M5MbgBghuJNajbQjaY3pVJId0M+bC1QFELCydCp20Bx
sZjW9/DeNsCDTDhi5JSCPyWAkT4G9VcpIuyBqe62rb7ggBZp1YRqnM/KSt4l
ABp3Zc+1HCRlF8QKQbx7SYW7oFxDp58O+PivYmAQendt/3JAaKRH6QaB7aRg
YgFItgAGGNsLgIQCEKnvZEIWCNk0ArGlCENIwpQKMCOgdzV3IxFr+gcKreGU
NJ05lBMGgPelCJObAEIBCbbNweKjoAZNIyKBpQS6MFtjA8EpRdRqPIhzOB2V
YN9GFUIQB1RRbrhb2dv0PwKjoGSQB7jpCkTlfEbdVuWL+YDGkg5+WsBa1jMj
yKs70fw1H2AhagqEZOqGpD4g4bSJK8EVsNfXEPrItt69sYBkwGk5Q7QPx+5K
X1bsAQA2qxGZYHIAjPpDNdX1Khuw0FjSyhYlXp7JBZ8DTpEfJvq9PXhqatJV
AMxI3DQA/nf6P0PobP1vZ5MI3ADA0CbiQdgjViBuR6iNSu58DUOnFPc3DYDe
95nTvtthaGMOSPN7eR/SwFky9uuNjHqtwGP8LcKtAGDydvXBFeDbHze0y66h
Ie2oZ2mwBc2I4gB208u0xtXENVbiz21MhpTbwPfQJgXTNhqyiAIgoqpYq+iT
6m0wWVx0zMatHjyk3D1q/CPLdv+oFQAOHz48MjIySfpj3Lp1K0s6m0zydCaM
awDwD+UeshIOYIRktwFIEDHsjAZgLE9PR6en12ZmSvl81Q1efCtnieexEIzZ
NwKHXRDFBo2NVV2n99ZhePgKnqoslx8DzEjYQpHGpW4prIPS12qwqQcPa9vk
G8o1+DrgeE+cOMHcr4Uw1Be9oxvDQ5sxMTxoJ2778EAg8AOrKQjNA8DfgurZ
Hauylj4Plu0TuadiDR6rlFuOIBacU1rgAbAAz3+z2aPkacYSBhCD/rMNgIPw
AB6zBI8pAg+cw5VCfe/UBsBVeD4m1gNgLE1NFQg8z2azv3VOaf8XYACbumOQ
Xqkv2QAAAABJRU5ErkJggg==
	</icon>
</catalog>
